1,pending,9,7,ACCOUNT LOCK WARNING,Your account will be blocked by Administrator admin. Please contact them immediately to discuss
2,sent,9,9,ACCOUNT LOCK WARNING,Your account will be blocked by Administrator admin. Please contact them immediately to discuss
3,pending,12,2,Application,applying for this job
4,pending,12,2,Application,apply noew
5,pending,9,9,Admin Reply,message coubter is whay??
6,pending,9,4,ACCOUNT LOCK WARNING,Your account will be blocked by Administrator admin. Please contact them immediately to discuss
7,pending,12,2,Application,dgdfgdfg
